Track Name,Artists,Album,Duration (ms),Popularity,Track URL
Ghost Town,"VINAI, John De Sohn",Ghost Town,155409,38,https://open.spotify.com/track/4PPCWezfTaXfJxvJh3scND
10:35,"Tiësto, Tate McRae",DRIVE,172252,77,https://open.spotify.com/track/36gcliMRX1vCpgnrZE3dFZ
Who's Holding You,"VIZE, Dario Rodriguez, Lagique",Who's Holding You,161478,29,https://open.spotify.com/track/4ji0j6QV4GgH6fVeEEamrO
Hide Away,"VINAI, LA Vision",Hide Away,150750,57,https://open.spotify.com/track/0CQctRjgAceCvmtQ1CCY22
Sacrifice,"Besomorph, RIELL",Sacrifice,133124,0,https://open.spotify.com/track/2YO9S16xa3rnM8LZGntcHX
Fantasize,"Dream Chaos, Britt",Fantasize,145461,0,https://open.spotify.com/track/3wX2U0wWZ1SuOTyRxRtiNj
Happy (feat. Tiina),"KSHMR, Tiina",Happy (feat. Tiina),210666,37,https://open.spotify.com/track/3CjdXar5vfq39M06YNwCE0
After Midnight (feat. Xoro),"Lucas & Steve, Yves V, Xoro",After Midnight (feat. Xoro),143526,55,https://open.spotify.com/track/5ANWAzmveemGd3Zqb5FXR1
Burn With You,"Poylow, DENNICK, Dave Who, Zev",Burn With You,121904,19,https://open.spotify.com/track/5LDxZwLlaV2a5mkgIONrt9
Something,"Hr. Troels, Morty Simmons, Crystal Rock, Romy Dya",Something,203250,48,https://open.spotify.com/track/1KgU8LZ7MWxBkCugjWFRJ2
Devil,"B3nte, Alex D'Rosso, B3VA",Devil,138661,16,https://open.spotify.com/track/0ZrJ5soMgpRi6YcU9U1iCK
Ocean Of Tears,"Imanbek, DVBBS",Ocean Of Tears,184462,48,https://open.spotify.com/track/6oJIAZpChGNIEMAecud9SZ
Hey Baby (Drop It To The Floor),"Poylow, Kverz, SKYWALKER",Hey Baby (Drop It To The Floor),124218,37,https://open.spotify.com/track/2iY8LkEDOXNfEkmxSSYlZ9
In Your Sleep,GRY,In Your Sleep,153139,28,https://open.spotify.com/track/7aLFMzV4rlvylwnHlAZYug
Typical (feat. Lars Martin),"Alok, Steve Aoki, Lars Martin",Typical (feat. Lars Martin),141312,40,https://open.spotify.com/track/0zbCQ5BMhpFfKWcpEuzqVd
How to Save a Life,"Yohan Gerber, Poylow, CRVN",How to Save a Life,147187,22,https://open.spotify.com/track/4UsOdefEGR3cuhmatZfQO9
Stay,"Blasterjaxx, Marnik, LUNAX",Stay,150620,42,https://open.spotify.com/track/5IeFO7aWhkpFmaHKr3QyJV
Ghost Town (Lucas Estrada Remix),"VINAI, John De Sohn, Lucas Estrada",Ghost Town (Lucas Estrada Remix),137957,59,https://open.spotify.com/track/0ndg56b510prqHlImqJoxG
Frozen River (feat. Jessica Chertock),"Hard Lights, Mangoo, Felix Schorn, Jessica Chertock",Frozen River (feat. Jessica Chertock),141101,33,https://open.spotify.com/track/6pnfPNXGDOpuMhHCM6YwN7
Imposter,"Zsá Zsá, VIZE, ALOTT",Imposter,191428,9,https://open.spotify.com/track/7MKqUpTcTDm9GIftq27t3j
Lights Go Out (feat. RBZ),"IZKO, Mangoo, Dawty, RBZ",Lights Go Out (feat. RBZ),180497,24,https://open.spotify.com/track/3kO727VBtNr8biUoubbnZH
Love U So,"Mike Candys, LUNAX",Love U So,155978,29,https://open.spotify.com/track/70uMBmsS1R4JEIENfW84re
Don't Save Me - Damon Sharpe Remix,"DVRKO, Tyler Graves, Damon Sharpe",Don't Save Me (Remixes),239879,0,https://open.spotify.com/track/57Qgc7xvg2XXv9QzvuIHqm
I Don't Wanna Talk,"Besomorph, HALUNA",I Don't Wanna Talk,146803,40,https://open.spotify.com/track/2vb2iUVBp3LFLAb3zl2Tmc
Boombox,"B3nte, B3VA",Boombox,129776,24,https://open.spotify.com/track/4CdOu8c92cSe1at4jXvWxN
Where Do We Go,"LUM!X, DVBBS",Where Do We Go,150476,55,https://open.spotify.com/track/5fBBhQfbpkYpGc0Qcax4FN
Feeling (Da Da Da),"Poylow, Faruk Orman, Todd Stucky",Feeling (Da Da Da),127619,31,https://open.spotify.com/track/0GmQMxJieu3K4vxtnJX28b
Leave The World Behind,"DVBBS, GATTÜSO, Alida",Leave The World Behind (feat. Alida),179092,0,https://open.spotify.com/track/7iVcAvK53hv3l2lHFzCyhW
Kingdom Come,"Moodygee, Marmy",Kingdom Come,126222,13,https://open.spotify.com/track/6UNuKc3xjT7h5ioP501DW3
La La La,"B3nte, B3VA",La La La,135692,48,https://open.spotify.com/track/5FzWSLtPEnVc3knAh070CA
Losing You,"Yves V, Ilkay Sencan",Losing You,170731,36,https://open.spotify.com/track/4sKdPLFdswFSOnVjqxJEHT
FAKE,"Besomorph, AViVA, RIELL",FAKE,136000,28,https://open.spotify.com/track/4xZ3gU3bsLUDXkv7xS0phG
Jenny (I Wanna Ruin Our Friendship),"Arcando, ThatBehavior, FJØRA",Jenny (I Wanna Ruin Our Friendship),166153,0,https://open.spotify.com/track/3gCpmhKc9E3Xk5YqpphZyJ
Ayo Technology - Dimitri Vegas Edit,"Dino Warriors, Julian Perretta, Dimitri Vegas",Ayo Technology (Dimitri Vegas Edit),173956,46,https://open.spotify.com/track/6A1CXveAYSTsfX9l86pEbd
Locked and Loaded,"Coopex, ZANA, CPX",Locked and Loaded,172920,21,https://open.spotify.com/track/6XA4ekTSAFz9pqTbgzK4N9
Love Is the Answer,"Skar & Manfree, Marnik",Love Is the Answer,183583,21,https://open.spotify.com/track/10WiU3Er0Yi2qetUwb3ikN
Over,"Coopex, Camilia",Over,168784,17,https://open.spotify.com/track/2m5SoTKYbQfjKLU0VqPTmt
Harry Potter Style,"Marnik, Alfons, Pule",Harry Potter Style,133235,40,https://open.spotify.com/track/3NrLEd1vtdhV4IANx14hQn
Under Control,"Coopex, Chase Miles, Highup, MINU",Under Control,144761,30,https://open.spotify.com/track/7DhZm79kpJ2Ksw65RCs9Vu
Say It Right,"Coopex, Feather, Alex D'Rosso",Say It Right,128095,44,https://open.spotify.com/track/5bwwLSTUK5A3gIxDgTWTun
Telephone,Raven & Kreyn,Telephone,141230,13,https://open.spotify.com/track/1ydx7dtHqcsTtjJqwvV3hM
Alone (Call My Own),"Hard Lights, Alfons, Flakkë",Alone (Call My Own),139449,28,https://open.spotify.com/track/5Q1dyJFyeaFo9PjfrGg2rc
Over You (feat. Lovespeake),"KSHMR, Lovespeake",Over You (feat. Lovespeake),173858,35,https://open.spotify.com/track/2WCInR4Z5mlpuk6qbYooQE
Puppeteer (with B3VA),"Alfons, B3nte, Jessica Chertock, B3VA",Puppeteer (with B3VA),153428,27,https://open.spotify.com/track/0yxgAA76Gk9KVW74Txgvcb
Light Up,"Mariana BO, Jerome, Crooked Bangs",Light Up,161378,43,https://open.spotify.com/track/319XgEPeEfhMw276p5wzg3
Why Do You Lie To Me (feat. Lil Baby) - Besomorph Remix,"Topic, A7S, Lil Baby, Besomorph",Why Do You Lie To Me (feat. Lil Baby) [Remixes],158000,30,https://open.spotify.com/track/6B7maLavnTIWoF5Tfqx7AJ
We Could Be Together,"Gabry Ponte, LUM!X, Daddy DJ",We Could Be Together (feat. Daddy DJ),149642,67,https://open.spotify.com/track/3ElGRG3DqSzzkh1b2wnbzf
Touch,VINAI,Touch,144677,58,https://open.spotify.com/track/2nCIE2AVFQ1adRVkocdGOp
Love Under Pressure - VIZE Remix,"James Blunt, VIZE",Love Under Pressure (VIZE Remix),177000,22,https://open.spotify.com/track/4SrNWh7XVaBQ31Md7VuQE1
The Lion (feat. Sara Sangfelt),"Dubdogz, Liu, Hard Lights, Sara Sangfelt",The Lion (feat. Sara Sangfelt),156394,38,https://open.spotify.com/track/4dilhWGYoBY6UJqAIyKMqm
Way Back Home,"VIZE, Anna Grey",Way Back Home,175960,47,https://open.spotify.com/track/6GWRcf3yBx3Y7pSScXoxGk
Bang Bang,Holy Molly,Bang Bang,162580,48,https://open.spotify.com/track/2mq1P9N8F2zVqM1FcJGia6
Dancing Alone,VIZE,Dancing Alone,172390,40,https://open.spotify.com/track/7A9y0ywTGS4iPM5huZAhKf
Downtown (with Kelvin Jones),"R3HAB, Kelvin Jones",Downtown (with Kelvin Jones),130125,17,https://open.spotify.com/track/7l5x1ePBMCWqMXwC68GKB6
Billie Jean,"Besomorph, Anthony Keyrouz, HINTRLAND",Billie Jean,210782,35,https://open.spotify.com/track/0QKbpBZOSF1TQidDTnCGN1
Scare Me (feat. Karra),"LUM!X, KSHMR, Gabry Ponte, Karra",Scare Me (feat. Karra),142222,58,https://open.spotify.com/track/6hKi0TR2wj6L9kyTLgfgFz
Across The Sun (feat. Vanessa Campagna),"Marnik, Orange INC, Vanessa Campagna",Across The Sun (feat. Vanessa Campagna),184921,34,https://open.spotify.com/track/68txCTTd4klNFmqRhdRqwC
Don't Stop,"Going Deeper, RITN",Don't Stop,165055,33,https://open.spotify.com/track/5RPl7AOZklwQgzrYc3Lucl
Scared,"SABAI, Olivia Ridgely",Scared,170000,52,https://open.spotify.com/track/2ktaGvlb0uE3tUQXy2oXoo
Raindrops,"Helion, Violet Days",Raindrops,151832,0,https://open.spotify.com/track/14DkH5iDM1ZaA3hMfJeRuM
Feels Like Summer,Sander van Doorn,Feels Like Summer,178222,52,https://open.spotify.com/track/3WkDoMgqtbQ34vToj64QcT
Midnight Sky,"Besomage, Gloria Kim, BRAN",Midnight Sky,168960,14,https://open.spotify.com/track/2w28l96zhjDUAGTanxjnSc
She's Wild - Lizot Remix,"Merk & Kremont, LIZOT",She's Wild (Lizot Remix),128371,18,https://open.spotify.com/track/0XmMHBtMflPx5m9P1OTUHo
Heartbreak Hotel,"Besomorph, Anthony Keyrouz, Jon Paul",Heartbreak Hotel,123870,28,https://open.spotify.com/track/5DeOUWTwAE6HhImDolzybY
Worst Mistake,"MOKABY, Coopex, Adam Trigger",Worst Mistake,150650,19,https://open.spotify.com/track/39TFRlah4iAIza7x6ssPUZ
So Done,"Blinded Hearts, Paradigm, Marmy",So Done,150117,25,https://open.spotify.com/track/0fjPCWzHGEJ4jXdjmjuQ0V
No Scrubs,MOTi,No Scrubs,168196,51,https://open.spotify.com/track/0sMA4yM4virFpGKst2Pt1N
Halo (feat. PIA MARIA),"LUM!X, PIA MARIA",Halo (feat. PIA MARIA),159600,56,https://open.spotify.com/track/6WVHfpzYW3HooQaCC80opC
Compromise,"Coopex, The FifthGuys, Shiah Maisel",Compromise,158765,11,https://open.spotify.com/track/1PpyMNmlyeX3OTCaGtVvrH
Another Level (ft. Lovespeake),"Timmy Trumpet, Lovespeake",Another Level (ft. Lovespeake),145941,45,https://open.spotify.com/track/2jSVBVxFFQY15Ce0V8HUH9
Meow - R3HAB Remix,"Kontra K, Eldzhey, R3HAB",Meow,167633,33,https://open.spotify.com/track/4TblDB7eQ0t49OX1QCDmIG
Maliboo,FRND,Maliboo,137000,0,https://open.spotify.com/track/6bDLlhpoHqJ2k64p3CMA19
Déjà Vu,"Yves V, INNA, Janieck",Déjà Vu,151967,46,https://open.spotify.com/track/5f6nlDTGRzH9zR7vHIxlp7
I Wanna Dance with Somebody (feat. The High),"Hard Lights, Behmer, The High",I Wanna Dance with Somebody (feat. The High),160480,48,https://open.spotify.com/track/6wa9YlQMYlnur0kdTDgwl8
Aurora (Hard Lights Remix),"K-391, RØRY, Hard Lights",Aurora (The Remixes),169053,33,https://open.spotify.com/track/0esrr1kWuUvArhYC1JZ7vL
STAY,"Dropgun, Ocean Dive, Junona Boys, Adam Christopher, Dan Berk",STAY,168750,0,https://open.spotify.com/track/2KOhM5kCOCZDIDvbSsix6x
Cry for You,"Cuebrick, Moestwanted, Melody Mane",Cry for You,138214,40,https://open.spotify.com/track/1E6VVToI1O0hpm8aHKfgfO
Through The Dark,"Steve Kroeger, Skye Holland",Through The Dark,164776,36,https://open.spotify.com/track/1pbnUeMiW9iXUCRI9ytrLF
Tesla,Rompasso,Tesla,146470,0,https://open.spotify.com/track/5vOP4d422dVasPiUPvWeeF
Calabria,"DMNDS, Fallen Roses, Dance Fruits Music, Lujavo, Nito-Onna",Calabria,128562,2,https://open.spotify.com/track/1evWpIlEfSZnXtHtpILB6b
Bugatti Ridin',Rolipso,Bugatti Ridin',113333,0,https://open.spotify.com/track/6J60bURyDlBj6MKyw7x2db
Low,"71 Digits, Flo Rida",Low,135483,57,https://open.spotify.com/track/4bAzLbJOkwkZEakSiKd3sZ
Dont Wanna Think About It,"Blinded Hearts, ZHIKO",Don't Wanna Think About It,156914,26,https://open.spotify.com/track/1KbilM5UyhJ9JHcEb0pcBj
Goodbye,Alex Parker,Goodbye,175161,24,https://open.spotify.com/track/388xh53BBoPSxyRUlO7Krk
Annie Are You Ok - LUM!X Remix,"LUM!X, Nick Strand, Mio",Annie Are You Ok (LUM!X Remix),154687,54,https://open.spotify.com/track/7kpviYjVYmD4VW7vsZTQCU
Bloodstream,"Paradigm, Scott Rill",Bloodstream,148715,44,https://open.spotify.com/track/7BJvauk2ddcxirw5px8Wfa
Blacklight,"Kush Kush, Sickmellow, Kazhi",Blacklight,166500,44,https://open.spotify.com/track/04k9VAadkf8nVcofogwUSj
Safe & Sound,"LUNAX, HUTS, Mary Jensen",Safe & Sound,137500,44,https://open.spotify.com/track/1BVdRzbsOEN7wXuFjeEbcE
What's Up?,"LIZOT, waybackwhen",What's Up?,168000,46,https://open.spotify.com/track/0QK4cKWv02vVr4RystlKqh
The Monster,"The FifthGuys, Godmode, Onyra",The Monster,156679,0,https://open.spotify.com/track/26egMh6SCmrRUYTmD3MZjc
I Just Wanna Dance,"Coldabank, Freedo",I Just Wanna Dance,154904,44,https://open.spotify.com/track/1LsoAswipJvPzdcSnoQ46C
So We Go (feat. Katy Tiz) - Martin Jensen Edit,"Gaullin, Katy Tiz, Martin Jensen",So We Go (feat. Katy Tiz) [Martin Jensen Edit],144624,0,https://open.spotify.com/track/5Miu1f5291Pct2SaQAv9HL
Alone Again (feat. PollyAnna),"Yves V, SESA, PollyAnna",Alone Again (feat. PollyAnna),157560,50,https://open.spotify.com/track/1xqbdoQipgmgFnGpCAtfrz
Dead Girl! (Shake My Head),"Au/Ra, Alan Walker",Dead Girl! (Shake My Head),194790,44,https://open.spotify.com/track/4inWxO0vnDzZsq32p0cHJm
Milky Way,"LUNAX, Coopex, Marmy",Milky Way,157968,21,https://open.spotify.com/track/19KRv5lu5kKJS8QXrtE9gO
i miss u - Liu Remix,"Jax Jones, Au/Ra, Liu",i miss u (Liu Remix),172687,36,https://open.spotify.com/track/7xgNYuOwQ8pBKuSGWuEL5C
Precious,"MOTi, LIZOT, Wilhelmina",Precious (with Wilhelmina),184687,19,https://open.spotify.com/track/1Xt4x0URNfzEufX54hK11h
Not My Style (R3HAB Remix),"Sarah Reeves, R3HAB",Not My Style (R3HAB Remix),136695,33,https://open.spotify.com/track/36NIj9MYZimIZs4ZonMIfk
Can't Sleep - Radio Version,"Ranji, Ghost Rider",Can't Sleep (Radio Version),201467,53,https://open.spotify.com/track/1ChzNnL5BTDCDYQHxrT1l9
Monster,"LUM!X, Gabry Ponte",Monster,154226,71,https://open.spotify.com/track/0YU17F0BlVXvmx5ytsR43w
Stars Align (with Jolin Tsai),"R3HAB, JOLIN",Stars Align (with Jolin Tsai),161904,47,https://open.spotify.com/track/2RQYvKXf2WG4bqN6hPRNq6
The Boss,"Coopex, Charles B, Robbie Rosen",The Boss,133809,20,https://open.spotify.com/track/6dMp3Hl0DO2YmxKAoGSt5P
Next Up,"HUTS, Jordan Jay, Idetto, Leo",Next Up,143801,20,https://open.spotify.com/track/6vTU2WCWYNugRYEMkCRZEY
Glad You Came,VIZE,Glad You Came,198095,55,https://open.spotify.com/track/5ohL55vbPhN999ETafibnk
Chain My Heart,"Topic, Bebe Rexha",Chain My Heart,146880,61,https://open.spotify.com/track/67lbzVADsqJJ6tyVk0XCgn
The Business,Tiësto,The Business,164000,77,https://open.spotify.com/track/6f3Slt0GbA2bPZlz0aIFXN
Rise Up (feat. Vamero),"VINAI, VAMERO",Rise Up (feat. Vamero),182000,66,https://open.spotify.com/track/46lyJh9GYmWsHez3EsvmAx
What I've Done,"Besomorph, Behmer, Lunis",What I've Done,141904,43,https://open.spotify.com/track/5rYkBePHNBTB9CmHP8Bsek
Butterfly,"Marnik, Hard Lights",Butterfly,170693,52,https://open.spotify.com/track/2Cm2RXqtcJtiWpSJrxuYwA
Lonely,"Tujamo, VIZE, MAJAN",Lonely,168725,55,https://open.spotify.com/track/5LOJdJPzuevskkoAtLj8hb
Tokyo,"Dwin, Kush Kush",Tokyo,132890,60,https://open.spotify.com/track/4obMuJXFa9APNiFtlQHFBh
Diamonds,Braaheim,Diamonds,146890,45,https://open.spotify.com/track/0y8bSLlOciVW9ejfEmExA9
Gangsta Paradise - NALYRO Remix,"Ricii Lompeurs, KEAN DYSSO, NALYRO",Gangsta Paradise (NALYRO Remix),140283,29,https://open.spotify.com/track/2EeyTiX4hOfzc3H5t2ZoOf
Alcohol,Holy Molly,Alcohol,153783,37,https://open.spotify.com/track/7bYPy3yXcsGN6xlupVUMIs
The Riddle,Ascence,The Riddle,164559,25,https://open.spotify.com/track/75EBAOmOzg658Lp4d6YTMI
Speechless (feat. Azteck),"Chico Rose, AFROJACK, Azteck",Speechless (feat. Azteck),177777,40,https://open.spotify.com/track/6KpvSUgYhZeymRRmUkVRzJ
Cause I`m Crazy,DJ Goja,Cause I`m Crazy,182727,0,https://open.spotify.com/track/46HnRHizgaZ8n2iw5SpZtZ
Umbrella (with Marnik),"Hard Lights, Moonshine, Marnik, Ember Island",Umbrella (with Marnik),180426,54,https://open.spotify.com/track/20PbUoGyGk7jJgLAgqlauh
Give My All - Martin Jensen Edit,"Gabry Ponte, Martin Jensen",Give My All (Martin Jensen Edit),144960,34,https://open.spotify.com/track/6E7Ovp9cEyqP99kIAitoW5
Too Late,"Steve Kroeger, Meggie York",Too Late,158181,24,https://open.spotify.com/track/78h3hHbxiyKJouFEx6brwN
Ok Without You,Klaas,Ok Without You,170880,55,https://open.spotify.com/track/7GvzyeeBMoDlC9OziuPMQQ
One More Dance (with Alida),"R3HAB, Alida",One More Dance (with Alida),145161,32,https://open.spotify.com/track/0a1UxIZ5WqPWbKHFa5zbm4
Love Again (feat. Alida),"Alok, Alida",Love Again (feat. Alida),147401,61,https://open.spotify.com/track/63bWXWGcWnRQvdS8bJWdkB
Love In Your Eyes (feat. Bibiane Z),"Mausio, Bibiane Z",Love In Your Eyes (feat. Bibiane Z),188319,40,https://open.spotify.com/track/2JsuDhOIJYXwp9A57kuzGm
Home,"Freischwimmer, Marmy",Home,173292,16,https://open.spotify.com/track/1eBUxkjBx13nuuYwUHunZA
Fortune Teller - Radio Edit,Perfect Pitch,Fortune Teller,157000,7,https://open.spotify.com/track/6XRWr6iDy5Chkj6GrUDjx3
Space Melody (Edward Artemyev) (feat. Leony),"VIZE, Alan Walker, Edward Artemyev, Leony",Space Melody (Edward Artemyev) (feat. Leony),180151,60,https://open.spotify.com/track/0FRavXSn6XmeItbuJR3VrR
Head Shoulders Knees & Toes (feat. Norma Jean Martine),"Ofenbach, Quarterhead, Norma Jean Martine",Head Shoulders Knees & Toes (feat. Norma Jean Martine),156960,55,https://open.spotify.com/track/14ngWWxvUSnIMXgF6rzSk1
Virus,"Eastblock Bitches, OBS",Virus,142408,43,https://open.spotify.com/track/4YXwvMkVmoNQR4UCn2VcEr
Wake Me Up In Paris,"Anthony Keyrouz, Paradigm",Wake Me Up In Paris,136946,66,https://open.spotify.com/track/4dq7XLDmFHNwc1yqL339qT
Fire,"NALYRO, Giorgio Gee, WONGA",Fire,142200,0,https://open.spotify.com/track/4SRBCRgHcjlObsVI5hCNMB
Your Love (9PM) - Tiësto Remix,"ATB, Topic, A7S, Tiësto",Your Love (9PM) [Tiësto Remix],186531,55,https://open.spotify.com/track/3ZUGQQQdTteMWdPg2bvLsp
Have You Never Been Mellow,Keanu Silva,Have You Never Been Mellow,147742,38,https://open.spotify.com/track/6a92Xzgq2rDcISB4St84Bs
Where Have You Been,"Coopex, New Beat Order, Britt",Where Have You Been,174101,25,https://open.spotify.com/track/2eMf4ZFYfspnPfK3lGeQlk
Do It Right,Perfect Pitch,Do It Right,150002,26,https://open.spotify.com/track/08s6gVAGNsmTOWDPfjpn6A
Electric Sun,Tiggi Hawke,Electric Sun,177303,29,https://open.spotify.com/track/5BVViZEhtgvJFheQOJtCso
Hypnotized,"Crystal Rock, Felix Schorn, Flip Capella, Stephanie Schulte",Hypnotized,160000,40,https://open.spotify.com/track/6l4aAgffkIQeIoGr5Ze52v
Weekend (feat. Emelie Cyréus),"LIZOT, Emelie Cyréus",Weekend (feat. Emelie Cyréus),132775,58,https://open.spotify.com/track/4KPYXZUCKYLEEcGmKN4Exs
I Fly with You,"DJ Sammy, Loona",I Fly with You,187619,20,https://open.spotify.com/track/58v5dzHr3DE8kTZX8s51c4
Dolly Song (Devil's Cup),"VIZE, Leony",Dolly Song (Devil's Cup),157945,52,https://open.spotify.com/track/530sGWWlefN6YmGtBOPPME
Don't Be Shy,"Tiësto, KAROL G",Don't Be Shy,140500,76,https://open.spotify.com/track/0bI7K9Becu2dtXK1Q3cZNB
Game,"MÖWE, VAMERO",Game,165245,33,https://open.spotify.com/track/7vcke4pdk4tuDmdSoCHgg3
First Day,"Shiah Maisel, Coopex",First Day,147500,0,https://open.spotify.com/track/6WtujwMiaGVx7XLXaywF5A
Lonely,"Gabry Ponte, Jerome",Lonely,168888,55,https://open.spotify.com/track/6l15fvZdCB1pvNgeuFk6Fw
Into You,"Devan, Amero",Into You,154285,30,https://open.spotify.com/track/1nKUqpHuLUQnxEVmmBOI4E
Seesaw,Ummet Ozcan,Seesaw,177931,62,https://open.spotify.com/track/4DdE6uEJFRcnoplLN26i1B
All The Things She Said,"Ilkay Sencan, Faruk Sabanci",All The Things She Said,169102,51,https://open.spotify.com/track/4oFjWv0hf8gPkG6ASFJTHz
Menage A Trois,"LIZOT, Holy Molly",Menage A Trois,168508,49,https://open.spotify.com/track/40vCMTDaDwwpf7DyBlmgEj
Wasted Love (feat. Lagique),"Ofenbach, Lagique",Wasted Love (feat. Lagique),139563,66,https://open.spotify.com/track/2pPO9YecZimmuVQfIzfV6U
Now You're Gone,"Galwaro, Helion",Now You're Gone,125114,0,https://open.spotify.com/track/7qbHTj7ApagHHtp7UYNVBG
Genie in a Bottle - Klaas Original Edit,"Flaremode, Klaas",Genie in a Bottle (Klaas Original Edit),144226,41,https://open.spotify.com/track/2qK6OAMBkQg9l7mwAgCCGT
Overdose,"Mike Candys, Neptunica, Marmy",Overdose,140887,49,https://open.spotify.com/track/7d0DnTugSgbAiYtcEkZqWN
Alone (feat. Anjulie & Jeffrey Jey) - Triangle Remix,"Marnik, KSHMR, Anjulie, Jeffrey Jey, Triangle",Alone (feat. Anjulie & Jeffrey Jey) [Triangle Remix],193750,34,https://open.spotify.com/track/2RZnNR3IIjOxuRBzx9K3yP
Lost In Love,"MOTi, A7S","Club Zero Cool, Vol. 2",153292,38,https://open.spotify.com/track/5GVDLNEeFiSwUlVqAhxq3c
Like True Lovers Do,Sunlike Brothers,Like True Lovers Do,144766,0,https://open.spotify.com/track/00N8fWE0L794hJoD77V6c9
Somebody Like You,"Martin Trevy, HAWK., Marmy",Somebody Like You,175248,0,https://open.spotify.com/track/6T5rBm4nZNB1f19d4uOGwR
Eternally,Bruman,Eternally,166879,11,https://open.spotify.com/track/7K4zK9fWMwpEXKeKx5ESGu
Down,"Kilian K, Derrick Ryan",Down,127951,0,https://open.spotify.com/track/5E8hCu7nyZqin5lCRPZP4A
Superstar,"Wolfpack, Angemi, Flaremode",Superstar,163363,16,https://open.spotify.com/track/78wcUP8PIyPEoAOWqp0iHM
Fucked Up,"Zombic, Blaze U, Leo",Fucked Up,133129,12,https://open.spotify.com/track/6adSkZi1VYkz0iyFlZAA28
L'Amour Vérité,Earz,L’Amour Vérité,182857,15,https://open.spotify.com/track/2F8dKc87GZ7r1Rqe46JvmM
Love in Pieces,DNSTY,Love in Pieces,153074,29,https://open.spotify.com/track/1yleWXKpmysGChwtvnopSp
End of Slaphouse,"VIZE, ALOTT",End of Slaphouse,181875,25,https://open.spotify.com/track/0U5Q2jPCuyQLCxb8LYYD90
Ride With Me (feat. Kid Ink) - Gabry Ponte Remix,"Tungevaag, Gabry Ponte, Kid Ink",Ride With Me (feat. Kid Ink) [Gabry Ponte Remix],154707,37,https://open.spotify.com/track/7H9EivBC2X4DfOq3h7MAkA
Tightrope,"MAXAM, LIZOT, Marmy",Tightrope,144457,36,https://open.spotify.com/track/7hdy8UqbRmEyOcsF1DcfhJ
Burn Me Up,"Besomorph, Paradigm, Noubya",Burn Me Up,151874,36,https://open.spotify.com/track/6EsDrYTBFHAYrOLrBQaNzj
Say My Name (Tonight),"Sevenn, Moonshine",Say My Name (Tonight),158001,43,https://open.spotify.com/track/5fZOKl5sqqdmWOrIwnjiSQ
Monkey Mind,"LIZOT, Paradigm, AMELY",Monkey Mind,126511,38,https://open.spotify.com/track/2PltG4dbyC0pxwjmWBFixT
Superman,"VINAI, Paolo Pellegrino, Shibui",Superman,136774,48,https://open.spotify.com/track/4gdp8cuXyhkr0bgtL9kCkZ
Alien - Topic Remix,"Dennis Lloyd, Topic",Alien (Topic Remix),159927,51,https://open.spotify.com/track/20Nj5d5LxOcja9a8JlU6Yi
On N On (feat. Leony),"VINAI, Leony",On N On (feat. Leony),151935,49,https://open.spotify.com/track/53IKe69OlZPlrDyS98geFO
I'm Okay,"HBz, OBS",I'm Okay,151723,49,https://open.spotify.com/track/4bt67pD5FiKIV5kn8ej38d
DA DI DA (Oh Oh),wnyng,DA DI DA (Oh Oh),127555,2,https://open.spotify.com/track/2WhpXie7mpaxPcn1S4Jgbq
Round & Round,Yves V,Round & Round,165120,49,https://open.spotify.com/track/2cE7I6BIi2GaVi5y0YYd5F
Poppin Bottles,"Chico Rose, Jaden Bojsen",Poppin Bottles,167822,54,https://open.spotify.com/track/2FIa0Zmilui8GpApF3vF1a
Dance Again,"Anthony Keyrouz, Ekko",Dance Again,152459,0,https://open.spotify.com/track/5mG9iopQWcGtc3SnrV3dA5
Secrets,"LUM!X, ONESOLO",Secrets,158181,54,https://open.spotify.com/track/5xjXfai7bW503D99N7ofqb
Drunk in Love,LUNAX,Slap House Party,165428,59,https://open.spotify.com/track/0rG5jvbdBRAg7paORdTWSe
Treat You Better,J.CMZ,Treat You Better,129522,23,https://open.spotify.com/track/4lqO2nI2c49X0LChIXWltC
YOLO,Roman Messer,YOLO,142622,5,https://open.spotify.com/track/7zaRa9LFomTQUfSjpSJ8cx
Superman (feat. Shibui) - Afrojack & Chico Rose Remix,"VINAI, Paolo Pellegrino, Shibui, AFROJACK, Chico Rose",Superman (feat. Shibui) [Afrojack & Chico Rose Remix],176715,31,https://open.spotify.com/track/6Qd9UkxzKEHwyYmHchl2QT
Dance With Your Devil,"Anthony Keyrouz, Paradigm",Dance With Your Devil,150952,43,https://open.spotify.com/track/3fWKUqt1i6CsEBLuB8IWJ1
Superhero,"LIZOT, Hyperclap, LUNAX",Superhero,131478,35,https://open.spotify.com/track/3SteozIweMB1gbHdCRc4zS
Lights,"Steve Kroeger, Crystal Rock, Jex",Lights,182769,32,https://open.spotify.com/track/3Za7unc5zoAdtGmtLSwNKg
Disturbia,"2Hounds, Mannymore, BASTL",Disturbia,187740,4,https://open.spotify.com/track/78BOOaAvxOywAnbINpmVqe
