Track Name,Artists,Album,Duration (ms),Popularity,Track URL
Where To Now - Will Atkinson Gold Mix,"Aly & Fila, Sue McLaren, Will Atkinson",Quiet Storm (Remixes) [Extended Versions],562285,6,https://open.spotify.com/track/4PoCumKVf5JX3OhAJZQEIB
Cala Bassa,David Broaders,Unity Gain E.P,208636,39,https://open.spotify.com/track/3PG8JJHzTiPHsNRGrxobe0
May The Road Rise,"John O'Callaghan, Paul Skelton, Ren Faye",May The Road Rise,239177,33,https://open.spotify.com/track/7FxlaeAuQ7lJ4FHL9iFdfU
The Awakening - NRG Trax Remix,"YORK, NRG Trax",The Awakening (NRG Trax Remix),162857,24,https://open.spotify.com/track/3oIXFLUUTNUUni2LyzML3I
Farewell To The Moon - Torsten Stenzel Sunset Mix,"YORK, Torsten Stenzel",Farewell To The Moon (Torsten Stenzel Sunset Mix),229565,26,https://open.spotify.com/track/4pzBoXzCB4kRe88CAl3q9u
Evoke - Extended Mix,"Simon Patterson, Magnus",Evoke,398000,17,https://open.spotify.com/track/0QuJBEhGVYcxIkCqE9aCSC
Echoes,"Mhammed El Alami, Hanna Finsen",Echoes,213913,22,https://open.spotify.com/track/7hkvZxJNGyItajl1OswyKH
Finding You,"Ciaran McAuley, Amos & Riot Night",Finding You,211714,29,https://open.spotify.com/track/1f80zbXrdtIkvSO25eqtb7
Viva La Vida,Jorn Van Deynhoven,The Future Is Now,227907,45,https://open.spotify.com/track/2j3UbEPf6ZPkdUhooNc676
Never Saw You Coming,"Alan Morris, Leddra Chapman",Never Saw You Coming,259130,33,https://open.spotify.com/track/5YnXotWEdYPyn3VeqeGKNX
Era,Ummet Ozcan,Era,284301,51,https://open.spotify.com/track/1eao1v2p0x5mckT9gMTOH6
Other Side of the World,"Craig Connelly, HALIENE",Other Side of the World,263913,34,https://open.spotify.com/track/651Kbc7yL6QyiPj0MeAanl
Helios,David Broaders,Helios,210059,31,https://open.spotify.com/track/2XU8Vvqbr6UqkJyVxDgha6
Made of Light - Radio Edit,"Alan Morris, Jess Morgan",Made of Light,248695,39,https://open.spotify.com/track/1qp2k5QYxWQK3SHpHbvwMc
Head Above Water,Temple One,Head Above Water,186086,12,https://open.spotify.com/track/6smsSrYAECas2DjmLcjBuU
Greece 2000 - Melih Kor Remix,"Three Drives On A Vinyl, Three Drives, Melih Kor",Greece 2000 (Remixes),199837,32,https://open.spotify.com/track/51ut8xEtPCkuWyHMujJrGw
We Are the Night,C-Systems,We Are the Night,183529,38,https://open.spotify.com/track/6lWwlMV4kSgDyfb1ipnpOC
Sometimes I Wish - Original Mix,"Tritonal, Bethany",Piercing The Quiet,329847,19,https://open.spotify.com/track/3EBfOvkTGK2CmMLqOa544I
Moonlight,"Alex M.O.R.P.H., Woody van Eyden, Marjan",Moonlight,191349,28,https://open.spotify.com/track/7CWuyO1HFwgnZaT7BComle
Living for the Moment,Apollo,Living for the Moment,158240,28,https://open.spotify.com/track/4QxNj4Ox3TAiBYrYXyzXA9
Can We Still Feel,"Andrew Rayel, Adara",Can We Still Feel,235000,35,https://open.spotify.com/track/4Kr9WurHeaE1JaI9WK3zGq
Through It All - Alex M.O.R.P.H. Extended Remix,"Claas Inc., Gid Sedgwick, Alex M.O.R.P.H.",Through It All,420532,3,https://open.spotify.com/track/1JEDHwyxEkKHz2ErUZ3wwe
Skyline - York Remix,"Thysma, Lauren L'aimant, YORK",Skyline (York Remix),233437,9,https://open.spotify.com/track/3RLM2xa2JaFCe0kjfiageS
My Good Place,"Aurosonic, Katty Heath",30 Vocal Trance Hits,249374,26,https://open.spotify.com/track/6JKz5WmCwKieDL4dbw8K1t
Not Enough Time 2.0,"Cosmic Gate, Emma Hewitt",20 Years [Forward Ever Backward Never],270351,31,https://open.spotify.com/track/4nqSXv0ifd0rPpFR1kJUfj
Lore,David Broaders,Lore,219952,31,https://open.spotify.com/track/0fuH8PTEbfLh4NLZ2xUkJh
Amsterdam - Super8 & Tab Extended Mix,"Luminary, Super8 & Tab",Super8 & Tab Presents: 20 Years Of Anjunabeats,493240,21,https://open.spotify.com/track/4MkOeDAyrYMaXBKUI1YhIw
The Whiteroom,"Andy Moor, Adam White, Whiteroom",The Whiteroom,233848,42,https://open.spotify.com/track/64AwAe6HpIEGFjy0KoGsmH
Hypnotized,"Ilan Bluestone, Stoneblue, Emma Hewitt",Hypnotized,224500,27,https://open.spotify.com/track/5ZsrTgKXsK6I71e65kF0WE
Someday,Doppenberg,Someday,170434,46,https://open.spotify.com/track/2PpIuWoPkilQBubfjZJerY
Magnificent,"Alex M.O.R.P.H., Faith Mark",Magnificent,201739,22,https://open.spotify.com/track/5vRS7k3p0DVlJiIct0hki8
Duality,Paul van Dyk,Duality,218540,54,https://open.spotify.com/track/75dtuLXf7uNtQNAGMDIM7k
The Deepest Truth,"Alan Morris, Marco Cera",The Deepest Truth,225000,2,https://open.spotify.com/track/4VmIHIHkclSO2d64I691cr
The Awakening - Quake Radio Edit,"YORK, Quake",The Awakening (NRG Trax Remix),213793,2,https://open.spotify.com/track/32oa9yjVeLN7cN1RtONOPS
An Angel's Love,"Alex M.O.R.P.H., Sylvia Tosun",An Angel's Love,185400,53,https://open.spotify.com/track/1UhHgUddUt2L7siqPsOoU7
Reach Across the Sky - Ben Gold Remix,"HALIENE, Ben Gold",Heavenly [Divine Edition],212888,22,https://open.spotify.com/track/3gSuDEIGq4yzVdZDGfO1Hp
Beautiful Life (Shine Ibiza Anthem 2023),"Paul van Dyk, Marc Van Linden, Sue McLaren",Beautiful Life (Shine Ibiza Anthem 2023),203738,34,https://open.spotify.com/track/1YTq0uv3qGz8xdacDzCzNX
Journey To Agartha,Temple One,Journey To Agartha,186086,41,https://open.spotify.com/track/6zootEAxzmClFbj12UNjyb
Empire Of Hearts,GAIA,Empire Of Hearts,198186,48,https://open.spotify.com/track/7v4J6QfxOM19QhrxhWB0r1
Now I See - Progressive Mix,"Aurosonic, Neev Kennedy",Now I See,437758,12,https://open.spotify.com/track/2wm5ShhCjtTiHl5OmFEMlH
The Time Is Now,"Costa, Maria Nayler",The Time Is Now,221764,36,https://open.spotify.com/track/55adpqBNS6o2r12rgRspWb
Shipwreck - Original Mix,"Craig Connelly, Cate Kanell",Shipwreck,483548,19,https://open.spotify.com/track/2OsHcxAE4E9n7z57yN5VAl
Echoes Of Courage,Ilan Bluestone,Echoes Of Courage,178370,37,https://open.spotify.com/track/3OCMeoGaTmxKS55xUNlDm9
Offshore,"Armin van Buuren, AVIRA, Chicane",Offshore,199680,33,https://open.spotify.com/track/6yf6FF8BxqLqEr87RFY96m
Sunshine Blue,"Denis Kenzo, Sveta B.",Sunshine Blue,211384,37,https://open.spotify.com/track/4hWbF0JW4nEW9zEn84eeU8
Just To Hear,"Denis Kenzo, Sveta B.",Just To Hear,201701,33,https://open.spotify.com/track/12RAKvnrvX0cxjIQowYnmO
The Force of The Blow - Radio Edit,"Ana Criado, Aurosonic",Vocal Trance Hits,270000,33,https://open.spotify.com/track/4iaJlXCVbjArR2XA1aujRf
Fallen Angel - Rework,"Dennis Sheperd, Ana Criado",Fallen Angel (Rework),245806,24,https://open.spotify.com/track/1YDN8sRKCA8vb4XIJHfHZ9
I'll Listen,"Armin van Buuren, Ana Criado",I'll Listen,215586,32,https://open.spotify.com/track/2dp7BcHmNiQtWn7DlzWsPx
Vulnerable - Denis Kenzo Edit,"Ana Criado, Denis Kenzo",Vocal Trance Hits,256874,36,https://open.spotify.com/track/0I1SXv9j9uPQBZZDKrARC3
Still There's You - A.R.D.I. Remix,"Ana Criado, A.r.d.i.",Still There's You (A.R.D.I. Remix),382287,19,https://open.spotify.com/track/58UBXVPmrWoPdruRqvNReu
Black Hole - Giuseppe Ottaviani Remix,"Craig Connelly, Christina Novelli, Giuseppe Ottaviani",Black Hole (Giuseppe Ottaviani + Ferry Tayle Remixes),241739,37,https://open.spotify.com/track/3ccGopj9VjCB6oJGTez5rh
This Life,"Craig Connelly, Roxanne Emery",This Life,226005,26,https://open.spotify.com/track/7KETzcOmo5LEgBVlwioq9J
Stay,"Craig Connelly, Jessica Lawrence",One Second Closer,308791,20,https://open.spotify.com/track/18pc5pljz7TzyeXApAm0Y5
Golden Gate,Craig Connelly,Golden Gate,243097,19,https://open.spotify.com/track/3QJoDu6VJTzpoQ5EgkuaJj
Believe,"Craig Connelly, Jessica Lawrence",Believe,247285,18,https://open.spotify.com/track/45p6srnwT7PKbNMfEUqiHL
Veins - Original Mix,"Craig Connelly, LJ Ayrten",Veins,480000,21,https://open.spotify.com/track/08sd1OHXbGeE6r0XamalE8
Behind Closed Doors,Craig Connelly,Behind Closed Doors,242021,14,https://open.spotify.com/track/4ynnaMdXUkFZB8cNReqiXz
Life Half Lived - Club Mix,"Craig Connelly, Karina Ramage",Life Half Lived,200490,13,https://open.spotify.com/track/24kZAREvLAcXr4QWUy7ih4
Solar Plexus,Sunny Lax,Solar Plexus / Torus,230625,28,https://open.spotify.com/track/501WQr4MIMq275ara82msQ
Night Sky,Sunny Lax,Night Sky,216093,18,https://open.spotify.com/track/6BJMgK71YzrlniKsCH30Is
Blue Bird - Daniel Kandi Remix,Sunny Lax,Blue Bird,451813,11,https://open.spotify.com/track/0PltBcZTBspgs7FVuZjxcC
Run Away,"Denis Kenzo, Angel Falls",A State Of Trance Radio Top 20 - November / December 2016 (Including Classic Bonus Track),240000,14,https://open.spotify.com/track/1hBITfwWNmIesmYDD7f2sR
Sounds of Time - Adam Ellis Remix,"Phillip J, Kim Casandra, Adam Ellis",Sounds of Time (Adam Ellis Remix),478219,5,https://open.spotify.com/track/4XjwTY2f9nuzkzPwzEaLWC
Safe On Both Sides,Andy Moor,Safe On Both Sides,253500,37,https://open.spotify.com/track/1cZivVegnjX0KRzX5wDkEV
Faces,"Andy Moor, Ashley Wallbridge, Meighan Nealon",Ashley Wallbridge Mini Mix 1,177106,32,https://open.spotify.com/track/6nLujiLQQNYCuAz4Lh1Y1d
Free Fall,"Andy Moor, Somna, Monika Santucci",Free Fall,243582,29,https://open.spotify.com/track/3H0ZwEOOZn3hqvaTVkPWYq
She Moves - Original Mix,"Andy Moor, Carrie Skipper",She Moves,550832,31,https://open.spotify.com/track/5WID4Dm1MktMmsnGksMeSz
11 Days - Sebastian Brandt Rework,"Cold Blue, Del Mar, Sebastian Brandt","Trance Top 1000 Selection, Vol. 1",199347,31,https://open.spotify.com/track/4QBP4YN0nienNZlK0chbOi
Kaia,Bryan Kearney,Kaia,220869,47,https://open.spotify.com/track/4XTMWFtx4OIifgUwpwcrEi
Now I Can Breathe Again - Greg Downey Remix,"Simon Patterson, Lucy Pullin, Greg Downey",Now I Can Breathe Again (Greg Downey Remix),233142,34,https://open.spotify.com/track/0cePFtWn6iVU09ThY11n6F
Saving Angel,"RAM, Stine Grove",Saving Angel,195907,32,https://open.spotify.com/track/4egd4JqR5mRAYK2tz7KOmM
Metropolis,Gareth Emery,Exposure / Metropolis,208656,33,https://open.spotify.com/track/5dbhpbAEBtHVQYjrzC5yfz
Fortress - Dan Stone Edit,"Ost & Meyer, Ronski Speed, Cate Kanell, Dan Stone",Fortress,233315,26,https://open.spotify.com/track/5C1YeYW3IyfZY73UG8WOs2
Alone In The Wilderness,Davey Asprey,Alone In The Wilderness,187875,37,https://open.spotify.com/track/49FG9giyUiSOyQECFhfFZ4
Closer Than Close - Original Mix,"Suncatcher, Caitlin Stubbs",Closer Than Close,189829,31,https://open.spotify.com/track/74tftidpid80uhjI6CWypf
Soul From Harm - Radio Edit,"Stargazers, Fenna Day",Soul From Harm,213529,38,https://open.spotify.com/track/6P88CCeahOEjrhJYX1IArF
Sunset Boulevard - ASOT Mix Cut,"Alex M.O.R.P.H., Ana Criado",Sunset Boulevard,221413,37,https://open.spotify.com/track/446cNKGNeeMjSJZbcNTbxx
Why Can't You Love Me - Radio Edit,"Kaimo K, Sarah Russell",Why Can't You Love Me,245217,28,https://open.spotify.com/track/0lmefasm3tpYvHO5MlK02G
Dream Like I Do - Extended Mix,"Darren Porter, Ana Criado",Dream Like I Do,465882,24,https://open.spotify.com/track/00yzOk2tJB4rSOnWEXiZEg
Black Hole - Jorn van Deynhoven Remix,"Craig Connelly, Christina Novelli, Jorn Van Deynhoven",Black Hole,507950,22,https://open.spotify.com/track/0R2hkZBWDnw5kgzoTO7Nhs
The Reason - Club Mix,"Alex M.O.R.P.H., Natalie Gioia",The Reason,402452,26,https://open.spotify.com/track/2Nrhy89l7QecW7c01D9Vn1
Rebirth - Ahmed Romel Remix,"Aly & Fila, Ahmed Romel",Rebirth (Ahmed Romel Remix),284782,28,https://open.spotify.com/track/2GcymupHpe3UznMIRx2oXU
Hold Your Head Up High - Aly & Fila Remix,"Roger Shah, Aisling Jarvis, Aly & Fila",Hold Your Head Up High (Aly & Fila Remix),243478,16,https://open.spotify.com/track/6puwTJ3qdpbpcfPbjWJsVf
Lost - Will Atkinson Remix,"Sunlounger, Zara Taylor, Will Atkinson",Lost (Will Atkinson Remix),205714,27,https://open.spotify.com/track/19QUNfdeb5aWHObd54vpvu
Love You Are Made Of,"James Dymond, Susana",Love You Are Made Of,238260,20,https://open.spotify.com/track/7pwqDGv3EHpfITZNU5vdjA
Brand New World of Light,"Jericho Frequency, Ellie Lawson",Brand New World of Light,168106,28,https://open.spotify.com/track/4QNksSE5dIPlHaZlvhl9re
Crashing Over,"Factor B, Cat Martin",A State Of Trance Showcase - Mix 019: Factor B,228695,32,https://open.spotify.com/track/5NClQ9SIyAstcSGRutoHyF
Silver Lining,AmyElle,Silver Lining,189375,28,https://open.spotify.com/track/0lnvO4NJ3bqBLL0vHfjeOx
We Control The Sunlight,"Aly & Fila, Jwaydan",Armada Collected: Aly & Fila,226673,47,https://open.spotify.com/track/7LpshpG8snNJYdD7TnHS0I
Children - Radio Edit,Robert Miles,"60 Best Trance Hits Ever, Vol. 2",242000,1,https://open.spotify.com/track/74BmnSR6ECVZdXnl0cPY7a
What Are You Waiting For - VIP,Stonebank,What Are You Waiting For (VIP),299130,36,https://open.spotify.com/track/7E4IssrzkldvqRfSG2ox57
Show Me The Stars,"Temple One, Sarah Lynn",Best Of Vocal Trance 2016,232065,47,https://open.spotify.com/track/4rNcp8APoiq7DiCcq4netm
Stella,Tenishia,Stella,196931,40,https://open.spotify.com/track/3MS0HpBpVvcxL6MLO7PRee
Serenity,"Roman Messer, Cari",Dream,262065,25,https://open.spotify.com/track/6RNKnOGcdNs4E48Ym5omRq
No One Else,"Ultimate, Moonsouls, Marjan",No One Else,203217,39,https://open.spotify.com/track/2MZVwdDxt4JAtoph570Cji
Hidden Sun of Serenity,"Alex M.O.R.P.H., Cheryl Barnes",Hidden Sun of Serenity,202941,37,https://open.spotify.com/track/0sYtfrqzkX7H75NoykUOUt
Guided by Fire - stream version,OWL.,Guided by Fire,214028,23,https://open.spotify.com/track/4qsGgUOyb1fImioifRTbvb
